SQL 
---------------------------------------------------------------------------------
create  table personal (empid integer,name char(20),bloodgroup char(5),emergencyno integer);

insert into personal values(1,'peter','a1+ve',999);
insert into personal values(2,'raju','a1',222);
insert into personal values(3,'john','o+ve',333);

commit;

create  table official (empid integer,department char(10),salary number(10,2));
insert into official values(1,'sales',2345.5);
insert into official values(2,'marketing',12345.5);
commit;
select *from official;
 delete from official where empid=1;


select p.name,p.bloodgroup,o.department,o.salary from personal p,official o where p.empid=o.empid;
----------------------------------------------------------------------------------------------------
SELECT S.SNAME FROM SAILORS S WHERE S.SID IN (SELECT R.SID FROM RESERVE R WHERE R.BID=101);
SELECT S.SNAME FROM SAILORS S,RESERVE R WHERE S.SID=R.SID AND R.BID=101;

SELECT S.SNAME FROM SAILORS S WHERE EXISTS(SELECT *FROM RESERVE R WHERE R.BID=101 AND S.SID=R.SID);
------------------------------------------------------------------------------------------------------
CREATE TABLE PRODUCT(PRODID INTEGER PRIMARY KEY,PRODNAME VARCHAR2(20));
INSERT INTO PRODUCT VALUES(1,'MOBILE');
INSERT INTO PRODUCT VALUES(2,'WATCH');

DROP TABLE PRODUCT;
CREATE TABLE PRODUCT(PRODID INTEGER,PRODNAME VARCHAR2(20));
INSERT INTO PRODUCT VALUES(1,'MOBILE');
INSERT INTO PRODUCT VALUES(1,'WATCH');

ALTER TABLE PRODUCT ADD CONSTRAINT PK1 PRIMARY KEY(PRODID);
INSERT INTO PRODUCT VALUES(3,'LAPTOP');
 DROP TABLE CUSTOMER;
 
CREATE TABLE CUSTOMER(CUSTID INTEGER PRIMARY KEY,CUSTNAME VARCHAR(20));
INSERT INTO CUSTOMER VALUES(101,'RATNA');
INSERT INTO CUSTOMER VALUES(102,'ATHIRA');
INSERT INTO CUSTOMER VALUES(103,'RIYA');
INSERT INTO CUSTOMER VALUES(104,'APARNA');

ALTER TABLE CUSTOMER ADD CONSTRAINT UK1 UNIQUE (CUSTNAME);
COMMIT;
---------------------------------------------------------------------------------------------------
CREATE TABLE ORDER1(ORDERID INTEGER PRIMARY KEY,CUSTID INTEGER,PRODNAME VARCHAR2(20));
ALTER TABLE ORDER1 ADD CONSTRAINT FK1 FOREIGN KEY(CUSTID) REFERENCES CUSTOMER(CUSTID);

INSERT INTO ORDER1 VALUES(1,101,'BAGS');
-------------------------------------------------------------------------------------------------------
CREATE TABLE AUTHORS(AUTHORID INTEGER PRIMARY KEY,AUTHORNAME VARCHAR2(20));
INSERT INTO AUTHORS VALUES(101,'ENID BLYTON');
INSERT INTO AUTHORS VALUES(102,'PAULO COELHO');

CREATE TABLE BOOKS(BOOKID INTEGER PRIMARY KEY,AUTHORID INTEGER,BOOKNAME VARCHAR2(20));
ALTER TABLE BOOKS ADD CONSTRAINT FK2 FOREIGN KEY(AUTHORID) REFERENCES AUTHORS(AUTHORID);
INSERT INTO BOOKS VALUES(101,101,'FAMOUS FIVE');
INSERT INTO BOOKS VALUES(102,102,'THE ALCHEMIST');
INSERT INTO BOOKS VALUES(103,101,'SECRET SEVEN');
-------------------------------------------------------------------------------------------------------------
ALTER TABLE EMPLOYEE ADD CONSTRAINT CHK2 CHECK(CITY IN ('BANGALORE','MYSORE'));


CREATE TABLE EMPLOYEE1(EMPID INTEGER PRIMARY KEY,EMPNAME VARCHAR2(20),MGRID INTEGER);
INSERT INTO EMPLOYEE1 VALUES(1,'JOHN',2);
INSERT INTO EMPLOYEE1 VALUES(2,'PETER',3);
INSERT INTO EMPLOYEE1 VALUES(3,'RAJ',0);
INSERT INTO EMPLOYEE1 VALUES(4,'RAHIM',2);
INSERT INTO EMPLOYEE1 VALUES(5,'STEPHEN',2);

SELECT E.EMPNAME,E.MGRID FROM EMPLOYEE1 E, EMPLOYEE1 M WHERE E.MGRID=M.EMPID;

-----------------------------------------------------------------------------------------------------------------

COMMAND PROMPT

SQL> select *from tab;

TNAME                          TABTYPE  CLUSTERID
------------------------------ ------- ----------
BONUS                          TABLE
DEPT                           TABLE
EMP                            TABLE
SALGRADE                       TABLE

SQL> create  table persons(LastName VARCHAR(20),FirstName CHAR(20),Address CHAR(20), cITY CHAR(20));

Table created.

SQL> DESCRIBE persons;
 Name                                      Null?    Type
 ----------------------------------------- -------- ----------------------------
 LASTNAME                                           VARCHAR2(20)
 FIRSTNAME                                          CHAR(20)
 ADDRESS                                            CHAR(20)
 CITY                                               CHAR(20)

SQL> select *from persons;
SQL> insert into persons values('hansen','ola','whitefield','bangalore');

1 row created.

SQL> insert into persons values('scott','tiger','domlur','bangalore');

1 row created.

SQL> insert into persons values('levine','emmanual','paravur','ekm');

1 row created.

SQL> insert into persons values('sanjay','rohit','thiruvaniyoor','ekm');

1 row created.

SQL> insert into persons values('aparna','bhatt','chennai','tamilnadu');

1 row created.

SQL> select *from persons;

LASTNAME             FIRSTNAME            ADDRESS
-------------------- -------------------- --------------------
CITY
--------------------
hansen               ola                  whitefield
bangalore

scott                tiger                domlur
bangalore

levine               emmanual             paravur
ekm


LASTNAME             FIRSTNAME            ADDRESS
-------------------- -------------------- --------------------
CITY
--------------------
sanjay               rohit                thiruvaniyoor
ekm

aparna               bhatt                chennai
tamilnadu


SQL> select lastname from persons;

LASTNAME
--------------------
hansen
scott
levine
sanjay
aparna

SQL> insert into persons values('reshma','bhatt','chennai','tamilnadu');

1 row created.
SQL> select firstname from persons;

FIRSTNAME
--------------------
ola
tiger
emmanual
rohit
bhatt
bhatt

6 rows selected.
SQL> select distinct(firstname)from persons;

FIRSTNAME
--------------------
bhatt
ola
emmanual
tiger
rohit

SQL> select *from persons where city='bangalore';

LASTNAME             FIRSTNAME            ADDRESS
-------------------- -------------------- --------------------
CITY
--------------------
hansen               ola                  whitefield
bangalore

scott                tiger                domlur
bangalore


SQL> select firstname,city from persons where city='bangalore';

FIRSTNAME            CITY
-------------------- --------------------
ola                  bangalore
tiger                bangalore

SQL> select firstname,city from persons where city<>'bangalore';

FIRSTNAME            CITY
-------------------- --------------------
emmanual             ekm
rohit                ekm
bhatt                tamilnadu
bhatt                tamilnadu

SQL> select firstname,city from persons where city!='bangalore';

FIRSTNAME            CITY
-------------------- --------------------
emmanual             ekm
rohit                ekm
bhatt                tamilnadu
bhatt                tamilnadu

SQL> select *from persons where firstname='ola';

LASTNAME             FIRSTNAME            ADDRESS
-------------------- -------------------- --------------------
CITY
--------------------
hansen               ola                  whitefield
bangalore


SQL> select *from persons where firstname<>'ola';

LASTNAME             FIRSTNAME            ADDRESS
-------------------- -------------------- --------------------
CITY
--------------------
scott                tiger                domlur
bangalore

levine               emmanual             paravur
ekm

sanjay               rohit                thiruvaniyoor
ekm


LASTNAME             FIRSTNAME            ADDRESS
-------------------- -------------------- --------------------
CITY
--------------------
aparna               bhatt                chennai
tamilnadu

reshma               bhatt                chennai
tamilnadu


SQL> select *from persons where firstname like'lev%';

no rows selected

SQL> select *from persons where firstname like'emm%';

LASTNAME             FIRSTNAME            ADDRESS
-------------------- -------------------- --------------------
CITY
--------------------
levine               emmanual             paravur
ekm


SQL> select *from persons where firstname like'%nu%';

LASTNAME             FIRSTNAME            ADDRESS
-------------------- -------------------- --------------------
CITY
--------------------
levine               emmanual             paravur
ekm


SQL> insert into persons(firstname,lastname) values('divyasree','technopolis'):
  2
SQL> insert into persons(firstname,lastname) values('divyasree','technopolis');

1 row created.

SQL> update persons set city= 'mumbai' where firstname='emmanual';

1 row updated.

SQL> select *from persons where firstname like'%nu%';

LASTNAME             FIRSTNAME            ADDRESS
-------------------- -------------------- --------------------
CITY
--------------------
levine               emmanual             paravur
mumbai

SQL> SELECT ABS(-15) FROM DUAL;

  ABS(-15)
----------
        15

SQL> SELECT CEIL(15) FROM DUAL;

  CEIL(15)
----------
        15

SQL> SELECT CEIL(15.6) FROM DUAL;

CEIL(15.6)
----------
        16

SQL> SELECT CEIL(15.3) FROM DUAL;

CEIL(15.3)
----------
        16

SQL> SELECT FLOOR(15.3) FROM DUAL;

FLOOR(15.3)
-----------
         15

SQL> SELECT FLOOR(15.6) FROM DUAL;

FLOOR(15.6)
-----------
         15

SQL> SELECT FLOOR(15.56) FROM DUAL;

FLOOR(15.56)
------------
          15

SQL> SELECT FLOOR(15.66) FROM DUAL;

FLOOR(15.66)
------------
          15

SQL> SELECT TRUNC(15.6690,1) FROM DUAL;

TRUNC(15.6690,1)
----------------
            15.6

SQL> SELECT TRUNC(15.6690,4) FROM DUAL;

TRUNC(15.6690,4)
----------------
          15.669

SQL> SELECT TRUNC(15.6690,3) FROM DUAL;

TRUNC(15.6690,3)
----------------
          15.669

SQL> SELECT TRUNC(15.6690,2) FROM DUAL;

TRUNC(15.6690,2)
----------------
           15.66

SQL> SELECT TRUNC(15.6690,1) FROM DUAL;

TRUNC(15.6690,1)
----------------
            15.6

SQL> SELECT ROUND(15.6690,1) FROM DUAL;

ROUND(15.6690,1)
----------------
            15.7

SQL> SELECT ROUND(15.6690,3) FROM DUAL;

ROUND(15.6690,3)
----------------
          15.669

SQL> SELECT ROUND(15.6690,2) FROM DUAL;

ROUND(15.6690,2)
----------------
           15.67

SQL> SELECT ROUND(15.6690,0) FROM DUAL;

ROUND(15.6690,0)
----------------
              16

SQL> SELECT CONCAT('ONE','TWO') FROM DUAL;

CONCAT
------
ONETWO
SQL> SELECT LOWER('DELOITTE') FROM DUAL;

LOWER('D
--------
deloitte

SQL> SELECT upper('DELOITTE') FROM DUAL;

UPPER('D
--------
DELOITTE

SQL> SELECT substr('DELOITTE',2,4) FROM DUAL;

SUBS
----
ELOI

SQL> select length('deloitte') from dual;

LENGTH('DELOITTE')
------------------
                 8
SQL> select count(*) from persons group by city;

  COUNT(*)
----------
         1
         2
         2
         1
         1

SQL> select city,count(*) from persons group by city;

CITY                   COUNT(*)
-------------------- ----------
                              1
bangalore                     2
tamilnadu                     2
ekm                           1
mumbai                        1

SQL> CREATE TABLE EMPLOYEE(NAME CHAR(20),SALARY NUMBER(10,2),DEPARTMENT CHAR(20));

Table created.

SQL> INSERT INTO EMPLOYEE VALUES('RAM',35000.23,'SALES');

1 row created.

SQL> INSERT INTO EMPLOYEE VALUES('ROHAN',45000,'ACCOUNTS');

1 row created.

SQL> INSERT INTO EMPLOYEE VALUES('MEERA',55000,'ACCOUNTS');

1 row created.

SQL> INSERT INTO EMPLOYEE VALUES('MEERA',90000,'MARKETING');

1 row created.

SQL> INSERT INTO EMPLOYEE VALUES('DEEPTHI',90000,'HR');

1 row created.

SQL> INSERT INTO EMPLOYEE VALUES('DIVYA',9000,'SALES');

1 row created.

SQL> INSERT INTO EMPLOYEE VALUES('AARTHI',9000,'SALES');

1 row created.

SQL> INSERT INTO EMPLOYEE VALUES('THEERTHA',15000.50,'HR');

1 row created.

SQL> INSERT INTO EMPLOYEE VALUES('AARTHI',900000,'IT');

1 row created.

SQL> INSERT INTO EMPLOYEE VALUES('AARDHRA',900000,'IT');

1 row created.

SQL> SELECT DEPARTMENT,COUNT(*) FROM EMPLOYEE GROUP BY DEPARTMENT;

DEPARTMENT             COUNT(*)
-------------------- ----------
MARKETING                     1
HR                            2
SALES                         3
IT                            2
ACCOUNTS                      2

SQL> SELECT DEPARTMENT,SUM(SALARY) FROM EMPLOYEE GROUP BY DEPARTMENT;

DEPARTMENT           SUM(SALARY)
-------------------- -----------
MARKETING                  90000
HR                      105000.5
SALES                   53000.23
IT                       1800000
ACCOUNTS                  100000
SQL> SELECT DEPARTMENT,SUM(SALARY) FROM EMPLOYEE GROUP BY DEPARTMENT HAVING DEPARTMENT='SALES';

DEPARTMENT           SUM(SALARY)
-------------------- -----------
SALES                   53000.23

SQL> SELECT DEPARTMENT,AVG(SALARY) FROM EMPLOYEE GROUP BY DEPARTMENT HAVING DEPARTMENT='SALES';

DEPARTMENT           AVG(SALARY)
-------------------- -----------
SALES                 17666.7433

SQL> SELECT DEPARTMENT,AVG(SALARY) FROM EMPLOYEE GROUP BY DEPARTMENT HAVING DEPARTMENT='SALES';

DEPARTMENT           AVG(SALARY)
-------------------- -----------
SALES                 17666.7433

SQL> SELECT *FROM EMPLOYEE;

NAME                     SALARY DEPARTMENT
-------------------- ---------- --------------------
RAM                    35000.23 SALES
ROHAN                     45000 ACCOUNTS
MEERA                     55000 ACCOUNTS
MEERA                     90000 MARKETING
DEEPTHI                   90000 HR
DIVYA                      9000 SALES
AARTHI                     9000 SALES
THEERTHA                15000.5 HR
AARTHI                   900000 IT
AARDHRA                  900000 IT

10 rows selected.

SQL> SELECT NAME FROM EMPLOYEE WHERE SALARY=(SELECT SALARY FROM EMPLOYEE WHERE NAME='DIVYA');

NAME
--------------------
DIVYA
AARTHI



SQL> ALTER TABLE EMPLOYEE ADD CITY CHAR(20);

Table altered.

SQL> UPDATE TABLE EMPLOYEE SET CITY='BANGALORE' WHERE DEPARTMENT='IT';
UPDATE TABLE EMPLOYEE SET CITY='BANGALORE' WHERE DEPARTMENT='IT'
       *
ERROR at line 1:
ORA-00903: invalid table name


SQL> UPDATE EMPLOYEE SET CITY='BANGALORE' WHERE DEPARTMENT='IT';

2 rows updated.

SQL> SELECT NAME FROM EMPLOYEE WHERE SALARY=(SELECT MAX(SALARY) FROM EMPLOYEE WHERE CITY='BANGALORE');

NAME
--------------------
AARTHI
AARDHRA

SQL> SELECT NAME FROM EMPLOYEE WHERE SALARY=(SELECT MAX(SALARY) FROM EMPLOYEE WHERE CITY='BANGALORE') AND CITY='BANGALORE';

NAME
--------------------
AARTHI
AARDHRA

SQL> SELECT CITY,MAX(SALARY) FROM EMPLOYEE GROUP BY CITY HAVING CITY='BANGALORE';

CITY                 MAX(SALARY)
-------------------- -----------
BANGALORE                 900000

SQL> CREATE TABLE SAILORS(SID NUMBER,SNAME CHAR(20));

Table created.

SQL> CREATE TABLE RESERVE(SID NUMBER);

Table created.
SQL> INSERT INTO SAILORS VALUES(1001,'RAM');

1 row created.

SQL> INSERT INTO SAILORS VALUES(1002,'ROHIT');

1 row created.

SQL> INSERT INTO SAILORS VALUES(1003,'SANJAY');

1 row created.

SQL> INSERT INTO SAILORS VALUES(1004,'NIPUN');

1 row created.

SQL> INSERT INTO RESERVE VALUES(1004);

1 row created.

SQL> INSERT INTO RESERVE VALUES(1001);

1 row created.

SQL> INSERT INTO SAILORS VALUES(1005,'ROSHAN');

1 row created.
SQL> SELECT S.SNAME FROM SAILORS S WHERE S.SID IN (SELECT R.SID FROM RESERVE R WHERE R.SID=1001);

SNAME
--------------------
RAM

SQL> ALTER TABLE RESERVE ADD BID NUMBER;

Table altered.

SQL> UPDATE RESERVE SET BID=101 WHERE SID=1001;

1 row updated.

SQL> SELECT S.SNAME FROM SAILORS S WHERE S.SID IN (SELECT R.SID FROM RESERVE R WHERE R.BID=101);

SNAME
--------------------
RAM

SQL> commit;

Commit complete.